{
  "schema_version": "2.0",
  "id": "word.in.house",
  "revision": 1,
  "type": "word",
  "language": "lus",
  "status": "draft",
  "content": {
    "canonical_form": "In",
    "normalized_search": "in",
    "sense_key": "house",
    "part_of_speech": "noun",
    "definition_mizo": "Mihring chenna hmun.",
    "glosses": {"en": "house"},
    "examples": ["sentence.001"]
  },
  "learning": {
    "tq_level": "TQ0",
    "age_floor": 5,
    "age_ceiling": null,
    "skills": ["vocabulary", "reading"],
    "categories": ["home", "daily-life"],
    "difficulty": 1,
    "sensitive": false,
    "cultural_review_required": false,
    "game_modes": ["picture_match", "thumal_kawp", "spelling"]
  },
  "variants": [],
  "provenance": {
    "source_type": "author",
    "source_title": "Thumal Quest Phase 0 candidate pack",
    "source_locator": "pilot_candidates.csv",
    "contributor_id": "contributor.phase0",
    "machine_assisted": true,
    "machine_service": null,
    "machine_checked_at": null,
    "notes": "Draft only; requires two human approvals."
  },
  "rights": {
    "license": "project-owned-draft",
    "copyright_holder": "Thumal Quest project",
    "consent_record_id": null,
    "commercial_use_allowed": false,
    "derivatives_allowed": true,
    "attribution": null,
    "expires_at": null
  },
  "reviews": [],
  "created_at": "2026-09-13T00:00:00Z",
  "updated_at": "2026-09-13T00:00:00Z"
}
